{
    "id": "grumpig",
    "nid": "0326",
    "dexNum": 326,
    "formId": null,
    "name": "Grumpig",
    "formName": null,
    "region": "hoenn",
    "generation": 3,
    "type1": "psychic",
    "type2": null,
    "color": "purple",
    "abilities": {
        "primary": null,
        "secondary": null,
        "hidden": null
    },
    "isLegendary": false,
    "isMythical": false,
    "isUltraBeast": false,
    "ultraBeastCode": null,
    "isDefault": true,
    "isForm": false,
    "isSpecialAbilityForm": false,
    "isCosmeticForm": false,
    "isFemaleForm": false,
    "hasGenderDifferences": false,
    "isBattleOnlyForm": false,
    "isSwitchableForm": false,
    "isFusion": false,
    "fusedWith": null,
    "isMega": false,
    "isPrimal": false,
    "isRegional": false,
    "isGmax": false,
    "canGmax": false,
    "canDynamax": true,
    "canBeAlpha": false,
    "debutIn": "rs",
    "obtainableIn": [
        "bdsp",
        "e",
        "go",
        "oras",
        "rs"
    ],
    "onlyViaEventIn": [],
    "storableIn": [
        "b2w2",
        "bdsp",
        "bw",
        "dp",
        "e",
        "frlg",
        "go",
        "hgss",
        "home",
        "oras",
        "pt",
        "rs",
        "sm",
        "usum",
        "xy"
    ],
    "shinyReleased": true,
    "baseStats": {
        "hp": -1,
        "atk": -1,
        "def": -1,
        "spa": -1,
        "spd": -1,
        "spe": -1
    },
    "goStats": {
        "maxCP": -1,
        "attack": -1,
        "defense": -1,
        "stamina": -1
    },
    "weight": {
        "avg": "-1kg",
        "min": "-1kg",
        "max": "-1kg",
        "alpha": "-1kg"
    },
    "height": {
        "avg": "-1m",
        "min": "-1m",
        "max": "-1m",
        "alpha": "-1m"
    },
    "maleRate": -1,
    "femaleRate": -1,
    "refs": {
        "pogo": "GRUMPIG",
        "veekunDb": "grumpig",
        "serebii": "grumpig",
        "bulbapedia": "Grumpig",
        "homeSprite": "grumpig",
        "miniSprite": "grumpig",
        "showdown": "grumpig",
        "showdownDef": "Grumpig",
        "smogon": "grumpig"
    },
    "baseSpecies": null,
    "baseForms": [],
    "forms": [
        "grumpig"
    ],
    "evolutions": []
}
